index,published,keyword,domain,language,valid,title,description,url,image,archive,content,quote,de,en,la,added
39e1d22225dd4a91c9e59d584804b1cf,2025-11-12T04:34:51Z,'Vulkan Warnung',www.diepresse.com,de,0.1,Ein sterbendes Mädchen wurde zum Gesicht der Vulkankatastrophe von Armero [premium],Am 13. November 1985 zerstörte nach einem Ausbruch des Nevado del Ruiz eine Schlammlawine die kolumbianische Stadt Armero. Etwa 23.000 Menschen starben. Der tagelange Todeskampf der 13-jährigen Omayra Sánchez bewegte die Welt.,https://www.diepresse.com/20287446/ein-sterbendes-maedchen-wurde-zum-gesicht-der-vulkankatastrophe-von,https://img.diepresse.com/public/incoming/kt127i-sanchez.jpg/alternates/DPR_SOCIAL_MAGAZIN/sanchez.jpg,,"Zeitbombe nennt Ramon Antonio Rodriguez, Bürgermeister der kleinen kolumbianischen Stadt Armero, den Nevado del Ruiz. Ausbrüche des 5321 Meter hohen Vulkans töteten bereits in den Jahren 1595 und 184… [+5007 chars]",,Ein sterbendes Mädchen wurde zum Gesicht der Vulkankatastrophe von Armero [premium]. Am 13. November 1985 zerstörte nach einem Ausbruch des Nevado del Ruiz eine Schlammlawine die kolumbianische Stadt Armero. Etwa 23.000 Menschen starben. Der tagelange Todeskampf der 13-jährigen Omayra Sánchez bewegte die Welt.,"A dying girl became the face of the Armero volcanic disaster [premium]. On November 13, 1985, a mudslide destroyed the Colombian town of Armero following an eruption of the Nevado del Ruiz. About 23,000 people died. The day-long agony of 13-year-old Omayra Sánchez moved the world.","Factus est puella morientis facie Armero calamitatis molaris. Die 13 mensis Novembris anno 1985, limosus Colombian oppidum Armeroense post eruptionem Nevado del Ruiz delevit. Circiter viginti milia hominum mortui sunt. Omayra Sánchez movit mundum dies abhinc XIII annos.",2025-10-22 07:22:05+00:00
6a70dfe704a35cc8687971c25f2c52fb,2025-11-13T16:43:55Z,'Vulkan ausgebrochen',www.morgenpost.de,de,0.8,„Vulnado“ tobt auf Hawaii – Aufnahme zeigt Naturschauspiel,"Der Kīlauea-Vulkan im Pazifik ist erneut ausgebrochen. Diesmal kam es zu einem spektakulären Naturereignis, das Beobachter filmen konnten.",https://www.morgenpost.de/panorama/article410447501/vulnado-tobt-auf-hawaii-aufnahme-zeigt-naturschauspiel.html,https://img.sparknews.funkemedien.de/410447382/410447382_1763052236_v16_9_1600.jpeg,,"Am vergangenen Wochenende sorgte der Klauea-Vulkan auf Hawaii für ein beeindruckendes Naturschauspiel: In direkter Nähe zu einem Lavaausbruch formte sich ein seltener Vulnado. Ein Phänomen, bei dem v… [+852 chars]",,"„Vulnado“ tobt auf Hawaii – Aufnahme zeigt Naturschauspiel. Der Kīlauea-Vulkan im Pazifik ist erneut ausgebrochen. Diesmal kam es zu einem spektakulären Naturereignis, das Beobachter filmen konnten.",“Vulnado” rages in Hawaii – photo shows natural spectacle. The Kīlauea volcano in the Pacific has erupted again. This time there was a spectacular natural event that observers were able to film.,"""Vulnado"" in Hawaii saevit - spectaculum naturale photographicum ostendit. Volcano Kīlauea in Pacifico iterum erupit. Hoc tempore erat spectaculi eventus naturalis qui observatores cinematographici poterant.",2025-10-22 07:22:05+00:00
093bab06279597143831077af6523afa,2025-11-17T09:21:57Z,'Vulkan ausgebrochen',www.welt.de,de,0.9,"Vulkan Sakurajima bricht in Japan aus, Aschewolken über Kagoshima",Auf der Vulkaninsel Sakurajima im Südwesten Japans ist erneut der Vulkan ausgebrochen. Der Minamidake-Krater schleuderte eine mehrere tausend Meter hohe Rauch- und Aschewolke in den Himmel.,https://www.welt.de/vermischtes/video691adbf4c7cd0ff6c6204068/minamidake-krater-vulkan-sakurajima-bricht-in-japan-aus-aschewolken-ueber-kagoshima.html,https://images.welt.de/691adbf4c7cd0ff6c6204068/7c80c9285cdaa18e0732de470fd43cdc/ci16x9-w1200/welttv-vulkan-png,,Die WELT als ePaper: Die vollständige Ausgabe steht Ihnen bereits am Vorabend zur Verfügung so sind Sie immer hochaktuell informiert. Weitere Informationen https://epaper.welt.de,,"Vulkan Sakurajima bricht in Japan aus, Aschewolken über Kagoshima. Auf der Vulkaninsel Sakurajima im Südwesten Japans ist erneut der Vulkan ausgebrochen. Der Minamidake-Krater schleuderte eine mehrere tausend Meter hohe Rauch- und Aschewolke in den Himmel.","Sakurajima volcano erupts in Japan, ash clouds over Kagoshima. The volcano has erupted again on the volcanic island of Sakurajima in southwest Japan. The Minamidake crater ejected a cloud of smoke and ash several thousand meters high into the sky.","Volcano Sakurajima in Iaponiam erumpit, cinis nubes super Kagoshima. Volcano iterum in mola insula Sakurajima in Iaponiam meridiem erupit. Crater Minamidake nebulam fumi eiecit et cineres aliquot milia metrorum alta in caelum misit.",2025-10-22 07:22:05+00:00
23e6aa852e863962487cb37e1e123d83,2025-11-10T10:27:29Z,'Vulkanausbruch',www.tagesschau.de,de,1.0,Wie sich Neapel auf einen Vulkanausbruch vorbereitet,"In Neapel hat am Sonntag wieder die Erde gebebt. Ein kleineres Beben, das vor allem dort zu spüren war, wo unter der Erde die Phlegräischen Felder liegen. Sie gelten als Supervulkan. Tilmann Kleinjung war bei einer Evakuierungsübung dabei.",https://www.tagesschau.de/ausland/europa/italien-vulkan-evakuierungsuebung-100.html,https://images.tagesschau.de/image/89f52365-fe63-48ff-9cdf-5340712cc3be/AAABmmyb5aw/AAABmgWmh8Q/16x9-big/solfatara-neapel-100.jpg?width=1280,,"Stand: 10.11.2025 11:27 Uhr
In Neapel hat am Sonntag wieder die Erde gebebt. Ein kleineres Beben, das vor allem dort zu spüren war, wo unter der Erde die Phlegräischen Felder liegen. Sie gelten als … [+4294 chars]",,"Wie sich Neapel auf einen Vulkanausbruch vorbereitet. In Neapel hat am Sonntag wieder die Erde gebebt. Ein kleineres Beben, das vor allem dort zu spüren war, wo unter der Erde die Phlegräischen Felder liegen. Sie gelten als Supervulkan. Tilmann Kleinjung war bei einer Evakuierungsübung dabei.",How Naples prepares for a volcanic eruption. The earth shook again in Naples on Sunday. A smaller earthquake that was mainly felt where the Phlegraean Fields lie underground. They are considered a supervolcano. Tilmann Kleinjung took part in an evacuation exercise.,Quomodo Neapoli eruptionem molaris parat. Die Dominico in Neapolim iterum commota est terra. Terrae motus minor maxime sensit ubi campi Phlegraei sub terra iacent. Habentur supervolcani. Tilmann Kleinjung in evacuatione exercitii interfuit.,2025-10-22 07:22:05+00:00
c7cf1ad9b3ca7be388f0bf1e66876186,2025-11-19T14:00:22Z,'Vulkan ausgebrochen',www.stern.de,de,0.8,Vulkane: Indonesien: Vulkan Semeru spuckt 2.000 Meter hohe Aschesäule,Jakarta - In Indonesien ist der Vulkan Semeru auf der Insel Java ausgebrochen und hat eine kilometerhohe Aschewolke in den Himmel geworfen. Die Behörden,https://www.stern.de/panorama/vulkane--indonesien--vulkan-semeru-spuckt-2-000-meter-hohe-aschesaeule-36822876.html,https://image.stern.de/36822878/t/ad/v1/w1440/r1.7778/-/19--62mqzezjsnv5axs2048jpeg---d8fe55e99263df95.jpg,,"Kopiere den aktuellen Link
Zur Merkliste hinzufügen
Die Behörden rufen nach einem Ausbruch des Semeru auf Java die höchste Warnstufe aus. Zuvor hatte der Vulkan eine kilometerhohe Aschesäule gespuc… [+1017 chars]",,Vulkane: Indonesien: Vulkan Semeru spuckt 2.000 Meter hohe Aschesäule. Jakarta - In Indonesien ist der Vulkan Semeru auf der Insel Java ausgebrochen und hat eine kilometerhohe Aschewolke in den Himmel geworfen. Die Behörden,"Volcanoes: Indonesia: Semeru volcano spews 2,000 meter high ash column. Jakarta - In Indonesia, the Semeru volcano on the island of Java has erupted, sending a kilometer-high cloud of ash into the sky. The authorities","Vulcani: Indonesia: Semeru vulcano 2.000 metrorum altae columna cineris vomit. Batavia - In Indonesia, Vulcanus Semeru in insula Java erupit, kilometre altum nubem cineris in caelum mittens. Auctoritates",2025-11-21 07:22:05+00:00
4dcd749120b7ed0aafc1a201d96beaa9,2025-11-19T14:01:55Z,'Vulkan Warnstufe',www.tagesspiegel.de,de,0.8,Vulkane: Indonesien: Vulkan Semeru spuckt 2.000 Meter hohe Aschesäule,Die Behörden rufen nach einem Ausbruch des Semeru auf Java die höchste Warnstufe aus. Zuvor hatte der Vulkan eine kilometerhohe Aschesäule gespuckt.,https://www.tagesspiegel.de/gesellschaft/panorama/vulkane-indonesien-vulkan-semeru-spuckt-2000-meter-hohe-aschesaule-14886215.html,https://www.tagesspiegel.de/images/14886212/alternates/BASE_16_9_W1400/1763560915000/vulkan-semeru-in-indonesien-spuckt-aschesaule.jpeg,,In Indonesien ist der Vulkan Semeru auf der Insel Java ausgebrochen und hat eine kilometerhohe Aschewolke in den Himmel geworfen. Die Behörden in dem südostasiatischen Inselstaat hoben die Warnstufe … [+909 chars],,Vulkane: Indonesien: Vulkan Semeru spuckt 2.000 Meter hohe Aschesäule. Die Behörden rufen nach einem Ausbruch des Semeru auf Java die höchste Warnstufe aus. Zuvor hatte der Vulkan eine kilometerhohe Aschesäule gespuckt.,"Volcanoes: Indonesia: Semeru volcano spews 2,000 meter high ash column. The authorities are issuing the highest warning level after an eruption of Semeru on Java. The volcano had previously spewed a kilometer-high column of ash.",Vulcani: Indonesia: Semeru vulcano 2.000 metrorum altae columna cineris vomit. Auctoritates summo gradu monitionis post eruptionem Semeru in Java procedunt. Volcano antea kilometre emissa columna alta cineris erat.,2025-11-21 07:22:05+00:00
72922137ab6d1573b973e7f8dd03b131,2025-11-19T14:44:47Z,'Vulkan Aschewolke',orf.at,de,0.8,Höchste Warnstufe nach Ausbruch von indonesischem Vulkan,,https://orf.at/stories/3412009/,https://orf.at/mojo/1_4_1/storyserver//news/common/images/og-fallback-news.png,,"Im Osten der indonesischen Insel Java ist der Vulkan Semeru ausgebrochen, der nur rund 300 Kilometer von der beliebten Urlaubsinsel Bali entfernt ist. Bei der Eruption heute spuckte der Vulkan eine A… [+1115 chars]",,Höchste Warnstufe nach Ausbruch von indonesischem Vulkan. None,Highest warning level after Indonesian volcano eruption. None,Summa admonitio campestri post eruptionem vulcani Indonesiacam. Nullus,2025-11-21 07:22:05+00:00
51caca9e9978d0a135ac80dbab50cb98,2025-11-19T18:22:26Z,'Vulkan Aschewolke',www.bild.de,de,0.8,Höchste Warnstufe in Indonesien - Vulkan Semeru spuckt riesige Aschesäule,Eine riesige Aschewolke verdunkelt den Himmel über Java.,https://www.bild.de/news/hoechste-warnstufe-vulkan-semeru-spuckt-2-kilometer-hohe-aschesaeule-691dfaa4dca5d80035a073f4,"https://images.bild.de/691dfaa4dca5d80035a073f4/31a14b99a558ed28870c15d3f11fad7d,ecc25144?w=1280",,"Mehr zum Video anzeigen 
Eine riesige Aschewolke verdunkelt den Himmel über Java. Lawinen aus heißen Gasen, Aschepartikeln und Gestein stürzen mit hoher Geschwindigkeit am Vulkan Semeru herab.
Quel… [+35 chars]",,Höchste Warnstufe in Indonesien - Vulkan Semeru spuckt riesige Aschesäule. Eine riesige Aschewolke verdunkelt den Himmel über Java.,Highest warning level in Indonesia - Semeru volcano spews huge column of ash. A huge ash cloud darkens the sky over Java.,Summus admonitio campestri in Indonesia - Semeru vulcano ingentem cinerem agminis vomit. Iava nubes ingens ornus obumbrat caelum.,2025-11-21 07:22:05+00:00
336ad9ba72390b493e0e0a0b23080b75,2025-11-19T15:21:10Z,'Vulkan Aschewolke',www.focus.de,de,0.9,Vulkanausbruch in Indonesien: Aschewolke fliegt 2000 Meter hoch in den Himmel,"In Indonesien ist am Mittwoch der Vulkan Semeru auf der Insel Java ausgebrochen. Videos zeigen, wie dabei eine rund 2000 Meter hohe Aschewolke.",https://www.focus.de/panorama/welt/vulkanausbruch-in-indonesien-aschewolke-fliegt-2000-meter-hoch-in-den-himmel_635aef46-273b-4868-ac76-287f84e9a52b.html,https://quadro.burda-forward.de/ctf/9416b0ee-f938-4745-8f41-bf6e65d8deee.f6935071-56b0-43bf-96fe-eb72121fbabf.jpg?im=RegionOfInterestCrop%3D%281200%2C630%29%2CregionOfInterest%3D%281079%2C473%29&hash=86202d2e9474c9c39ff921b2a00c6511aa9147495d855d2ea228c57daea80468,,In Indonesien ist am Mittwoch der Vulkan Semeru auf der Insel Java ausgebrochen und hat eine rund 2000 Meter hohe Aschewolke in den Himmel geschleudert. Die Behörden hoben die Warnstufe für den Feuer… [+648 chars],,"Vulkanausbruch in Indonesien: Aschewolke fliegt 2000 Meter hoch in den Himmel. In Indonesien ist am Mittwoch der Vulkan Semeru auf der Insel Java ausgebrochen. Videos zeigen, wie dabei eine rund 2000 Meter hohe Aschewolke.","Volcanic eruption in Indonesia: ash cloud flies 2000 meters high into the sky. In Indonesia, the Semeru volcano on the island of Java erupted on Wednesday. Videos show how this creates an ash cloud around 2,000 meters high.","eruptio vulcanica in Indonesia: cinis nubes 2000 metrorum alta in caelum volat. In Indonesia, Semeru vulcano in insula Java die Mercurii erupit. Videos monstrare quomodo nubes haec cinerem circum 2000 metrorum altam creat.",2025-11-21 07:22:05+00:00
1a0091c31fc0d4930feaf6159f26a961,2025-11-19T16:24:00Z,'Vulkanausbruch',www.bild.de,de,0.9,Semeru spuckt riesige Aschesäule - Vulkanausbruch auf Urlaubsinsel!,Eine Aschewolke verdunkelte den Himmel über Java. Gleichzeitig flossen Glutlawinen herab,https://www.bild.de/news/ausland/vulkan-semeru-auf-indonesien-ausgebrochen-691dd530800234221d23b8da,"https://images.bild.de/691dd530800234221d23b8da/1bc8a5cf4885dfde8ba280cc2355ccb8,be623865?w=1280",,Jakarta (Indonesien) Nach dem Ausbruch des Vulkans Semeru in Indonesien haben die Behörden die höchste Warnstufe ausgerufen! Zuvor hatte eine kilometerhohe Aschewolke den Himmel über der beliebten Ur… [+1344 chars],,Semeru spuckt riesige Aschesäule - Vulkanausbruch auf Urlaubsinsel!. Eine Aschewolke verdunkelte den Himmel über Java. Gleichzeitig flossen Glutlawinen herab,"Semeru spews huge column of ash - volcanic eruption on holiday island! A cloud of ash darkened the sky over Java. At the same time, avalanches of embers flowed down",Semeru vomit columnam ingentem cinerum - eruptio molaris feriae insulae! Fraxinus nubes obumbravit caelum super Java. Eodem tempore avalanches favillae defluxerunt,2025-11-21 07:22:05+00:00
29f6a62eb1f146384ef0f8b42ee249ae,2025-11-20T08:28:07Z,'Vulkan ausgebrochen',www.zeit.de,de,0.8,Feuerberg auf Java brodelt: Vulkan Semeru ausgebrochen - Verletzte und schwere Schäden,Hier finden Sie Informationen zu dem Thema „Feuerberg auf Java brodelt“. Lesen Sie jetzt „Vulkan Semeru ausgebrochen - Verletzte und schwere Schäden“.,https://www.zeit.de/news/2025-11/20/vulkan-semeru-ausgebrochen-verletzte-und-schwere-schaeden,https://img.zeit.de/news/2025-11/20/vulkan-semeru-ausgebrochen-verletzte-und-schwere-schaeden-image-group/wide__1300x731,,"Der Vulkan Semeru auf der indonesischen Insel Java kommt weiter nicht zur Ruhe. Am Tag nach einer schweren Eruption, bei der der Feuerberg eine zwei Kilometer hohe Aschesäule in den Himmel gespuckt h… [+1402 chars]",,Feuerberg auf Java brodelt: Vulkan Semeru ausgebrochen - Verletzte und schwere Schäden. Hier finden Sie Informationen zu dem Thema „Feuerberg auf Java brodelt“. Lesen Sie jetzt „Vulkan Semeru ausgebrochen - Verletzte und schwere Schäden“.,Feuerberg on Java is bubbling: Semeru volcano erupted - injuries and serious damage. Here you will find information on the topic “Fire Mountain on Java is bubbling”. Now read “Semeru Volcano Erupted – Injuries and Severe Damage”.,"Feuerberg in Java bulliunt: Semeru vulcano erupit - iniurias et damnum grave. Hic informationes invenies in themate ""Ignis Mons in Java bulliente"". Nunc lege ""Semeru Volcano Erupted - Laesiones et Damnum grave"".",2025-11-21 19:19:35+00:00
36b1140486810085cbbb088ed72ef9fb,2025-11-20T08:28:07Z,'Vulkan ausgebrochen',www.stern.de,de,0.8,Feuerberg auf Java brodelt: Vulkan Semeru ausgebrochen - Verletzte und schwere Schäden,Der Mount Semeru in Indonesien macht den Behörden weiter Sorgen. Nach einem heftigen Ausbruch brodelt er weiter. Mehr als 1.000 Menschen sind schon auf der Flucht.,https://www.stern.de/panorama/feuerberg-auf-java-brodelt--vulkan-semeru-ausgebrochen---verletzte-und-schwere-schaeden-36824878.html,https://image.stern.de/36824880/t/dG/v1/w1440/r1.7778/-/20--t6sjokmkurv3axs2048jpeg---40601b682ad6e167.jpg,,"Kopiere den aktuellen Link
Zur Merkliste hinzufügen
Der Mount Semeru in Indonesien macht den Behörden weiter Sorgen. Nach einem heftigen Ausbruch brodelt er weiter. Mehr als 1.000 Menschen sind sch… [+1581 chars]",,Feuerberg auf Java brodelt: Vulkan Semeru ausgebrochen - Verletzte und schwere Schäden. Der Mount Semeru in Indonesien macht den Behörden weiter Sorgen. Nach einem heftigen Ausbruch brodelt er weiter. Mehr als 1.000 Menschen sind schon auf der Flucht.,"Feuerberg on Java is bubbling: Semeru volcano erupted - injuries and serious damage. Mount Semeru in Indonesia continues to worry the authorities. After a violent outburst, he continues to simmer. More than 1,000 people are already on the run.","Feuerberg in Java bulliunt: Semeru vulcano erupit - iniurias et damnum grave. Mons Semeru in Indonesia auctoritates sollicitare pergit. Post vehementi impetu pergit feruere. Plus quam 1,000 homines in spatio iam sunt.",2025-11-21 19:19:35+00:00
111cc3b097ef23a56b6fecb8f2872927,2025-11-20T08:30:03Z,'Vulkan ausgebrochen',www.tagesspiegel.de,de,0.8,Feuerberg auf Java brodelt: Vulkan Semeru ausgebrochen - Verletzte und schwere Schäden,Der Mount Semeru in Indonesien macht den Behörden weiter Sorgen. Nach einem heftigen Ausbruch brodelt er weiter. Mehr als 1.000 Menschen sind schon auf der Flucht.,https://www.tagesspiegel.de/gesellschaft/panorama/feuerberg-auf-java-brodelt-vulkan-semeru-ausgebrochen-verletzte-und-schwere-schaden-14891936.html,https://www.tagesspiegel.de/images/14891933/alternates/BASE_16_9_W1400/1763627403000/vulkan-semeru-in-indonesien-spuckt-aschesaule.jpeg,,"Der Vulkan Semeru auf der indonesischen Insel Java kommt weiter nicht zur Ruhe. Am Tag nach einer schweren Eruption, bei der der Feuerberg eine zwei Kilometer hohe Aschesäule in den Himmel gespuckt h… [+1458 chars]",,Feuerberg auf Java brodelt: Vulkan Semeru ausgebrochen - Verletzte und schwere Schäden. Der Mount Semeru in Indonesien macht den Behörden weiter Sorgen. Nach einem heftigen Ausbruch brodelt er weiter. Mehr als 1.000 Menschen sind schon auf der Flucht.,"Feuerberg on Java is bubbling: Semeru volcano erupted - injuries and serious damage. Mount Semeru in Indonesia continues to worry the authorities. After a violent outburst, he continues to simmer. More than 1,000 people are already on the run.","Feuerberg in Java bulliunt: Semeru vulcano erupit - iniurias et damnum grave. Mons Semeru in Indonesia auctoritates sollicitare pergit. Post vehementi impetu pergit feruere. Plus quam 1,000 homines in spatio iam sunt.",2025-11-21 19:19:35+00:00
161d6c3f93007725d579bab1f28eb411,2025-11-20T17:40:52Z,'Vulkan ausgebrochen',www.morgenpost.de,de,0.9,Indonesien: Vulkan ausgebrochen – gigantische Aschewolke begräbt Häuser,"Auf der indonesischen Insel Java spuckt der Vulkan Semeru Asche und Gestein. Drei Menschen wurden verletzt, viele Gebäude zerstört.",https://www.morgenpost.de/panorama/article410509243/indonesien-vulkan-ausgebrochen-gigantische-aschewolke-begraebt-haeuser.html,https://img.sparknews.funkemedien.de/410509184/410509184_1763653074_v16_9_1600.jpeg,,"Der Vulkan Semeru auf der indonesischen Insel Java kommt weiterhin nicht zu Ruhe. Am Tag nach einer schweren Eruption, bei der der Vulkan eine bis zu 13 Kilometer hohe Aschesäule in den Himmel schleu… [+2235 chars]",,"Indonesien: Vulkan ausgebrochen – gigantische Aschewolke begräbt Häuser. Auf der indonesischen Insel Java spuckt der Vulkan Semeru Asche und Gestein. Drei Menschen wurden verletzt, viele Gebäude zerstört.","Indonesia: Volcano erupts – gigantic ash cloud buries houses. On the Indonesian island of Java, the Semeru volcano spews ash and rock. Three people were injured and many buildings were destroyed.","Indonesia: Vulcanus erumpit - nubes cinis giganteus domos sepelit. In Indonesiaca insula Javae, Semeru vulcano cinerem et petram vomit. Tres homines laesi sunt et multa aedificia destructa sunt.",2025-11-21 19:19:35+00:00
f19349d38a5e77b4313cafcdda94322e,2025-11-20T08:17:32Z,'Vulkanausbruch',www.stern.de,de,0.9,Vulkanausbruch in Indonesien: Hunderte bringen sich auf Java in Sicherheit,"Nach dem Ausbruch des Vulkans Semeru haben sich auf der indonesischen Insel Java hunderte Menschen in Sicherheit gebracht. Fast 900 Menschen hätten die Nacht in Notunterkünften in Schulen, Moscheen und Gemeindesälen verbracht, sagte Sultan Syafaat von der Kat…",https://www.stern.de/news/vulkanausbruch-in-indonesien--hunderte-bringen-sich-auf-java-in-sicherheit-36824836.html,https://image.stern.de/36824838/t/Sm/v1/w1440/r1.7778/-/20--ein-mann-beobachtet-den-ausbruch-des-vulkans-semeru---2c7360655b710ed9.jpg,,"Kopiere den aktuellen Link
Zur Merkliste hinzufügen
Nach dem Ausbruch des Vulkans Semeru haben sich auf der indonesischen Insel Java hunderte Menschen in Sicherheit gebracht. Fast 900 Menschen hätt… [+1285 chars]",,"Vulkanausbruch in Indonesien: Hunderte bringen sich auf Java in Sicherheit. Nach dem Ausbruch des Vulkans Semeru haben sich auf der indonesischen Insel Java hunderte Menschen in Sicherheit gebracht. Fast 900 Menschen hätten die Nacht in Notunterkünften in Schulen, Moscheen und Gemeindesälen verbracht, sagte Sultan Syafaat von der Kat…","Volcano eruption in Indonesia: Hundreds flee to safety in Java. After the eruption of the Semeru volcano, hundreds of people have sought safety on the Indonesian island of Java. Almost 900 people spent the night in emergency shelters in schools, mosques and community halls, said Sultan Syafaat from the Cat...","Volcano eruptio in Indonesia: Centum fugae ad salutem in Java. Post eruptionem Semeru vulcani centeni homines in insula Java Indonesiaca salutem petierunt. Fere 900 hominum pernoctavit in tabernaculis in scholis, meschitis et atria communitatis, dixit Sultan Syafaat a Cat...",2025-11-22 07:20:00+00:00
41fd5aab8ccf1a368597fc7b8662a2c5,2025-11-20T08:59:38Z,'Vulkanausbruch',www.diepresse.com,de,0.9,Vulkanausbruch auf Java: Hunderte Indonesier bringen sich in Sicherheit,"Nach Ausbruch des Vulkans Semeru, des höchsten Berges auf Java, verbringen fast 900 Menschen die Nacht in Notunterkünften.",https://www.diepresse.com/20324845/vulkanausbruch-auf-java-hunderte-indonesier-bringen-sich-in-sicherheit,https://img.diepresse.com/public/incoming/lzrink-INDONESIA-VOLCANO/alternates/DPR_SOCIAL_NACHRICHTEN/INDONESIA-VOLCANO,,"Nach Ausbruch des Vulkans Semeru, des höchsten Berges auf Java, verbringen fast 900 Menschen die Nacht in Notunterkünften.
Nach dem Ausbruch des Vulkans Semeru haben sich auf der indonesischen Insel… [+1402 chars]",,"Vulkanausbruch auf Java: Hunderte Indonesier bringen sich in Sicherheit. Nach Ausbruch des Vulkans Semeru, des höchsten Berges auf Java, verbringen fast 900 Menschen die Nacht in Notunterkünften.","Volcanic eruption on Java: Hundreds of Indonesians flee to safety. After the eruption of the Semeru volcano, the highest mountain on Java, almost 900 people spent the night in emergency shelters.","eruptio vulcanica in Java: Centum Indonesiorum in salutem fugiunt. Post eruptionem Semeru vulcani, altissimus mons in Java, homines prope 900 nocte in tabernaculis subitis pernoctabant.",2025-11-22 07:20:00+00:00
2db7c70295f62743b3ec608538077aa5,2025-11-20T09:59:20Z,'Vulkanausbruch',www.stern.de,de,0.9,Vulkanausbruch,"Im Osten der indonesischen Insel Java blickt ein Mann auf die Gas- und Aschewolke, die der Vulkan Semeru nach einer Eruption am Mittwoch bis zu 13 Kilometer hoch in den Himmel gespuckt hatte.",https://www.stern.de/news/vulkanausbruch-36825450.html,https://image.stern.de/36825452/t/F6/v1/w1440/r1.7778/-/20--vulkanausbruch---36647d89d7cc65f8.jpg,,"Zugang zu stern+statt 11,96 
 nur 1  
<ul><li>Alles von stern+ mit erstklassigen Inhalten von GEO und Capital</li><li>4 Wochen testen, dann 2,99  je Woche</li><li>jederzeit kündbar</li></ul>",,"Vulkanausbruch. Im Osten der indonesischen Insel Java blickt ein Mann auf die Gas- und Aschewolke, die der Vulkan Semeru nach einer Eruption am Mittwoch bis zu 13 Kilometer hoch in den Himmel gespuckt hatte.","Volcanic eruption. In the east of the Indonesian island of Java, a man looks at the gas and ash cloud that the Semeru volcano spewed up to 13 kilometers into the sky after an eruption on Wednesday.","Eruptio vulcanicae. In insula Indonesiaca Iava orientali, homo vaporem et cinerem nubem spectat, quam Semeru vulcano usque ad XIII chiliometra in caelum post eruptionem Mercurii in caelum emissa est.",2025-11-22 07:20:00+00:00
491842c5ee9518e22cf8f2274b64d1d9,2025-11-07T12:38:07Z,'Vulkanausbruch',www.bild.de,de,0.9,"Es regnet Asche - Vulkanausbruch, geht AUF die Haut","Plötzlich hat die Meteorologin schwarze Flecken auf der Haut: Mit beeindruckender, aber zugleich beunruhigender Kraft bricht der Vul...",https://www.bild.de/news/vulkan-mount-kanlaons-ausbruch-fasziniert-690b78ed154e6f61444c6aba,"https://images.bild.de/690b78ed154e6f61444c6aba/ef36df98ba99b95d38cea374efda4b79-landscape,dd96ccdf?w=1280",,"Mehr zum Video anzeigen 
Plötzlich hat die Meteorologin schwarze Flecken auf der Haut: Mit beeindruckender, aber zugleich beunruhigender Kraft bricht der Vulkan Mount Kanlaon auf der zentralphilippi… [+95 chars]",,"Es regnet Asche - Vulkanausbruch, geht AUF die Haut. Plötzlich hat die Meteorologin schwarze Flecken auf der Haut: Mit beeindruckender, aber zugleich beunruhigender Kraft bricht der Vul...","It's raining ash - volcanic eruption, gets ON your skin. Suddenly the meteorologist has black spots on her skin: the volcano erupts with impressive but at the same time disturbing force...","Cinis pluit - eruptio vulcanica, cutem accipit. Subito meteorologus nigras maculas in cute eius habet: erumpit ignivomus cum infigo sed simul turbante.",2025-11-23 19:17:28+00:00
