index,published,keyword,domain,language,valid,title,description,url,image,archive,content,quote,de,en,la,added
5402270f539b314da8075f704209397d,2025-11-17T12:04:15Z,'Vulkanausbruch',www.diepresse.com,de,0.9,Die Nordlichter kamen zaghaft [premium],"Wenn von Nordlichtern die Rede ist, kann ich mich entspannt zurücklehnen: Ich hatte meine Dosis Aurora Borealis. Auf der Wunschliste ist nun Platz für anderes: einen Vulkanausbruch zum Beispiel. Diese Sichtung wollte sich knapp nicht ausgehen.",https://www.diepresse.com/20308944/die-nordlichter-kamen-zaghaft,https://img.diepresse.com/public/incoming/9f7ge4-kein-Titel/alternates/DPR_SOCIAL_MEINUNG/kein%20Titel,,"Reisen in den Hohen Norden litten immer etwas unter Erwartungsdruck, des Spektakels der Nordlichter gewahr zu werden, sie wie eine abstrakte Trophäe einfangen und mitnehmen zu können. Insofern waren … [+2755 chars]",,"Die Nordlichter kamen zaghaft [premium]. Wenn von Nordlichtern die Rede ist, kann ich mich entspannt zurücklehnen: Ich hatte meine Dosis Aurora Borealis. Auf der Wunschliste ist nun Platz für anderes: einen Vulkanausbruch zum Beispiel. Diese Sichtung wollte sich knapp nicht ausgehen.","The northern lights came timidly [premium]. When people talk about the Northern Lights, I can sit back and relax: I had my dose of Aurora Borealis. There is now room for other things on the wish list: a volcanic eruption, for example. This sighting just didn't go away.","Septemtrionales lumina timide venerunt. Cum de Septemtrionis Luminibus loquuntur, sedere possum ac relaxare: habui dosis Aurorae Borealis. Est nunc locus in aliis rebus in indice uoluntatis: eruptio molaris, exempli gratia. Hoc sighting iustus non abiit.",2025-11-23 19:17:28+00:00
2494a2cd47686f25de9b7ab59b16b7cd,2025-11-19T14:39:51Z,'Vulkan Aschewolke',www.tagesschau.de,de,0.9,Höchste Warnstufe auf indonesischer Insel Java nach Vulkanausbruch,Der Vulkan Semeru auf der indonesischen Insel Java spuckt derzeit kilometerhohe Aschewolken. Die Regierung hat die höchste Warnstufe ausgerufen. Mehr als 300 Menschen wurden in Sicherheit gebracht.,https://www.tagesschau.de/ausland/asien/indonesien-vulkan-ausbruch-semeru-100.html,https://images.tagesschau.de/image/bc908a5c-3941-47fd-afb1-217159c89be6/AAABmpxQjto/AAABmgWmh8Q/16x9-big/vulkan-semeru-102.jpg?width=1280,http://web.archive.org/web/20251122124637/https://www.tagesschau.de/ausland/asien/indonesien-vulkan-ausbruch-semeru-100.html,"Stand: 19.11.2025 15:39 Uhr
Der Vulkan Semeru auf der indonesischen Insel Java spuckt derzeit kilometerhohe Aschewolken. Die Regierung hat die höchste Warnstufe ausgerufen. Mehr als 300 Menschen wur… [+1438 chars]",,Höchste Warnstufe auf indonesischer Insel Java nach Vulkanausbruch. Der Vulkan Semeru auf der indonesischen Insel Java spuckt derzeit kilometerhohe Aschewolken. Die Regierung hat die höchste Warnstufe ausgerufen. Mehr als 300 Menschen wurden in Sicherheit gebracht.,Highest warning level on Indonesian island of Java after volcanic eruption. The Semeru volcano on the Indonesian island of Java is currently spewing ash clouds that are kilometers high. The government has declared the highest warning level. More than 300 people were brought to safety.,Maximum monitum planum in insula Javae Indonesiaca post eruptionem volcanicam. Semeru vulcano in insula Indonesiaca Javae nunc cineres nubes evomens quae chiliometrorum altae sunt. Summa admonitionis gradu imperium declaravit. Amplius trecenti homines ad salutem perducti sunt.,2025-11-23 19:17:28+00:00
60ee48b6a700a438629a085822ddb1b0,2025-11-20T09:06:00Z,'Vulkanausbruch',www.stern.de,de,0.9,Insel Java: Vulkanausbruch in Indonesien – Verletzte und schwere Schäden,Der Vulkan Semeru in Indonesien macht den Behörden weiter Sorgen. Nach einem heftigen Ausbruch brodelt er weiter. Mehr als 1000 Menschen sind schon auf der Flucht.,https://www.stern.de/panorama/weltgeschehen/vulkanausbruch-in-indonesien---verletzte-und-schaeden-36824950.html,https://image.stern.de/36824970/t/vb/v1/w1440/r1.7778/-/vulkanausbruch-indonesien.jpg,,"Kopiere den aktuellen Link
Zur Merkliste hinzufügen
Der Vulkan Semeru in Indonesien macht den Behörden weiter Sorgen. Nach einem heftigen Ausbruch brodelt er weiter. Mehr als 1000 Menschen sind sch… [+1556 chars]",,Insel Java: Vulkanausbruch in Indonesien – Verletzte und schwere Schäden. Der Vulkan Semeru in Indonesien macht den Behörden weiter Sorgen. Nach einem heftigen Ausbruch brodelt er weiter. Mehr als 1000 Menschen sind schon auf der Flucht.,"Java Island: Volcanic eruption in Indonesia – Injuries and severe damage. The Semeru volcano in Indonesia continues to worry the authorities. After a violent outburst, he continues to simmer. More than 1,000 people are already on the run.","Java Island: eruptio Volcanica in Indonesia - Laesiones et damnum grave. Semeru vulcano in Indonesia auctoritates sollicitare pergit. Post vehementi impetu pergit feruere. Plus quam 1,000 homines in spatio iam sunt.",2025-11-23 19:17:28+00:00
9d233dbe60f2cf149228aaf35c7217c3,2025-11-23T15:09:13Z,'Vulkanausbruch',www.morgenpost.de,de,0.9,Forscher finden neue Details zu Pompejis Untergang – „birgt Geheimnisse“,Noch immer ist der genaue Zeitpunkt des fatalen Vulkanausbruchs umstritten. Doch nun könnten Forscher das Rätsel gelöst haben.,https://www.morgenpost.de/panorama/article410526442/forscher-finden-neue-details-zu-pompejis-untergang-birgt-geheimnisse.html,https://img.sparknews.funkemedien.de/409246453/409246453_1749734142_v16_9_1600.jpeg,,"Der Ausbruch des Vesuv im Jahr 79 n. Chr., der die römische Stadt Pompeji unter Asche begrub, gilt als eine der bekanntesten Naturkatastrophen der Menschheitsgeschichte. Das genaue Datum des Ereignis… [+5249 chars]",,Forscher finden neue Details zu Pompejis Untergang – „birgt Geheimnisse“. Noch immer ist der genaue Zeitpunkt des fatalen Vulkanausbruchs umstritten. Doch nun könnten Forscher das Rätsel gelöst haben.,Researchers find new details about Pompeii's sinking – “hides secrets”. The exact time of the fatal volcanic eruption is still controversial. But now researchers may have solved the mystery.,"Investigatores inveniunt nova singularia de mergendo Pompeiano - ""pellis secreta"". Tempus fatale eruptionis molaris adhuc controversum est. Nunc autem inquisitores sacramentum solvisse possunt.",2025-11-24 19:16:20+00:00
ad82481e84fe17eb39fbfd2383d5b554,2025-11-24T14:30:13Z,'Vulkan Aschewolke',www.zeit.de,de,0.8,Aschewolke: Vulkan in Äthiopien bricht erstmals seit Jahrtausenden aus,Hier finden Sie Informationen zu dem Thema „Aschewolke“. Lesen Sie jetzt „Vulkan in Äthiopien bricht erstmals seit Jahrtausenden aus“.,https://www.zeit.de/news/2025-11/24/vulkan-in-aethiopien-bricht-erstmals-seit-jahrtausenden-aus,https://img.zeit.de/news/2025-11/24/vulkan-in-aethiopien-bricht-erstmals-seit-jahrtausenden-aus-image-group/wide__1300x731,,"In Äthiopien ist erstmals seit Tausenden von Jahren der Vulkan Hayli Gubbi ausgebrochen. Eine Aschewolke stieg bis auf 8,5 Kilometer Höhe auf und trieb ostwärts über die Arabische Halbinsel, wie das … [+957 chars]",,Aschewolke: Vulkan in Äthiopien bricht erstmals seit Jahrtausenden aus. Hier finden Sie Informationen zu dem Thema „Aschewolke“. Lesen Sie jetzt „Vulkan in Äthiopien bricht erstmals seit Jahrtausenden aus“.,Ash cloud: Volcano in Ethiopia erupts for the first time in thousands of years. Here you will find information on the topic of “ash clouds”. Now read “Volcano in Ethiopia erupts for first time in thousands of years”.,"Fraxinus nubes: Volcano in Aethiopia primum mille annis erumpit. Hic informationes invenies in argumento ""nubium cinerum"". Nunc legitur ""Vulcanus in Aethiopia primum mille annis erupit"".",2025-11-25 19:19:36+00:00
0995ea2f77f6daa474dd2dd733065b4f,2025-11-24T14:30:13Z,'Vulkan ausgebrochen',www.stern.de,de,0.8,Aschewolke: Vulkan in Äthiopien bricht erstmals seit Jahrtausenden aus,"Addis Abeba/Brüssel - In Äthiopien ist erstmals seit Tausenden von Jahren der Vulkan Hayli Gubbi ausgebrochen. Eine Aschewolke stieg bis auf 8,5",https://www.stern.de/panorama/aschewolke--vulkan-in-aethiopien-bricht-erstmals-seit-jahrtausenden-aus-36853274.html,https://image.stern.de/36853276/t/Ll/v1/w1440/r1.7778/-/24--2jzzokinvfv5axs2048jpeg---afa592321562d048.jpg,,"Kopiere den aktuellen Link
Zur Merkliste hinzufügen
Ein Vulkan erwacht, die Asche zieht über die Arabische Halbinsel. Im Umkreis des Bergs leben Tausende Menschen.
In Äthiopien ist erstmals seit T… [+1085 chars]",,"Aschewolke: Vulkan in Äthiopien bricht erstmals seit Jahrtausenden aus. Addis Abeba/Brüssel - In Äthiopien ist erstmals seit Tausenden von Jahren der Vulkan Hayli Gubbi ausgebrochen. Eine Aschewolke stieg bis auf 8,5",Ash cloud: Volcano in Ethiopia erupts for the first time in thousands of years. Addis Ababa/Brussels - The Hayli Gubbi volcano has erupted in Ethiopia for the first time in thousands of years. An ash cloud rose to 8.5,Fraxinus nubes: Volcano in Aethiopia primum mille annis erumpit. Addis Ababa/Bruxellis - Hayli Gubbi vulcano in Aethiopia primum in milibus annorum erupit. Cinis nubem resurrexit ad 8.5,2025-11-25 19:19:36+00:00
d4bda2385ba6ac818718d4770f05f886,2025-11-24T14:31:24Z,'Vulkan Aschewolke',www.tagesspiegel.de,de,0.8,Aschewolke: Vulkan in Äthiopien bricht erstmals seit Jahrtausenden aus,"Ein Vulkan erwacht, die Asche zieht über die Arabische Halbinsel. Im Umkreis des Bergs leben Tausende Menschen.",https://www.tagesspiegel.de/gesellschaft/panorama/aschewolke-vulkan-in-athiopien-bricht-erstmals-seit-jahrtausenden-aus-14933147.html,https://www.tagesspiegel.de/images/14933144/alternates/BASE_16_9_W1400/1763994684000/vulkanausbruch-in-athiopien.jpeg,,"In Äthiopien ist erstmals seit Tausenden von Jahren der Vulkan Hayli Gubbi ausgebrochen. Eine Aschewolke stieg bis auf 8,5 Kilometer Höhe auf und trieb ostwärts über die Arabische Halbinsel, wie das … [+1014 chars]",,"Aschewolke: Vulkan in Äthiopien bricht erstmals seit Jahrtausenden aus. Ein Vulkan erwacht, die Asche zieht über die Arabische Halbinsel. Im Umkreis des Bergs leben Tausende Menschen.","Ash cloud: Volcano in Ethiopia erupts for the first time in thousands of years. A volcano awakens, the ash spreads across the Arabian Peninsula. Thousands of people live around the mountain.","Fraxinus nubes: Volcano in Aethiopia primum mille annis erumpit. Volcano excitat, cinis per paeninsulam Arabicam diffunditur. Milia hominum circa montem habitant.",2025-11-25 19:19:36+00:00
7ce2eb97caae7fda3495214bcc740a1b,2025-11-24T16:54:02Z,'Vulkan Aschewolke',www.tagesschau.de,de,0.8,Seit 12.000 Jahren schlafender Vulkan in Äthiopien ausgebrochen,Jahrtausende hat der Vulkan Hayli Gubbi in Äthiopien geschlafen - nun ist er ausgebrochen. Todesopfer oder Schäden gibt es offenbar nicht. Eine kilometerhohe Aschewolke zog vom Horn von Afrika über die Arabische Halbinsel.,https://www.tagesschau.de/ausland/afrika/vulkan-aethiopien-ausbruch-100.html,https://images.tagesschau.de/image/43536233-32f8-442c-9942-8bb138803109/AAABmraW7KI/AAABmgWmh8Q/16x9-big/vulkan-gubbi-102.jpg?width=1280,http://web.archive.org/web/20251125060117/https://www.tagesschau.de/ausland/afrika/vulkan-aethiopien-ausbruch-100.html,"Stand: 24.11.2025 17:54 Uhr
Jahrtausende hat der Vulkan Hayli Gubbi in Äthiopien geschlafen - nun ist er ausgebrochen. Todesopfer oder Schäden gibt es offenbar nicht. Eine kilometerhohe Aschewolke z… [+1768 chars]",,Seit 12.000 Jahren schlafender Vulkan in Äthiopien ausgebrochen. Jahrtausende hat der Vulkan Hayli Gubbi in Äthiopien geschlafen - nun ist er ausgebrochen. Todesopfer oder Schäden gibt es offenbar nicht. Eine kilometerhohe Aschewolke zog vom Horn von Afrika über die Arabische Halbinsel.,"A volcano that has been dormant for 12,000 years erupted in Ethiopia. The Hayli Gubbi volcano in Ethiopia has been sleeping for thousands of years - now it has erupted. There are apparently no fatalities or damage. A kilometer-high ash cloud moved from the Horn of Africa across the Arabian Peninsula.",Volcano sopitam 12000 annorum in Aethiopia erupit. Volcano Hayli Gubbi in Aethiopia per mille annos dormiens - nunc erupit. Nullae videntur esse caedes vel damna. Nubes cineris altae chiliometrorum ex Horn Africae trans paeninsulam Arabicam mota.,2025-11-25 19:19:36+00:00
ffe74c490ee66fd6f176569025ae1ad2,2025-11-24T16:56:01Z,'Vulkan ausgebrochen',www.focus.de,de,0.8,"8,5 Kilometer hohe Aschewolke! Vulkan bricht erstmals seit Jahrtausenden aus","In Äthiopien bricht nach Jahrtausenden der Vulkan Hayli Gubbi aus. Satellitenbilder zeigen eine gigantische Aschewolke, die bis weit über die Region Afar hinauszieht.",https://www.focus.de/panorama/welt/8-5-kilometer-hohe-aschewolke-vulkan-bricht-erstmals-seit-jahrtausenden-aus_808a219f-257d-4b8c-806d-47d69924afc4.html,https://quadro.burda-forward.de/ctf/2bcee079-db19-40b0-be95-3e3e9ddcd964.b9a8cdfc-8094-46cb-95b5-e8b8ad16f9f1.jpg?im=RegionOfInterestCrop%3D%281200%2C630%29%2CregionOfInterest%3D%281019%2C479%29&hash=809c287534b1730ca40539ba85fcd4fd05fd37784b90ed32f4b70c7e43e5d75c,,"In Äthiopien ist erstmals seit Jahrtausenden der Vulkan Hayli Gubbi ausgebrochen. Videos und Satellitenbilder auf X zeigen eine bis zu 8,5 Kilometer hohe Aschewolke. Der Vulkan liegt in der abgelegen… [+1671 chars]",,"8,5 Kilometer hohe Aschewolke! Vulkan bricht erstmals seit Jahrtausenden aus. In Äthiopien bricht nach Jahrtausenden der Vulkan Hayli Gubbi aus. Satellitenbilder zeigen eine gigantische Aschewolke, die bis weit über die Region Afar hinauszieht.","Ash cloud 8.5 kilometers high! Volcano erupts for first time in thousands of years. In Ethiopia, the Hayli Gubbi volcano erupts after thousands of years. Satellite images show a gigantic ash cloud stretching far beyond the Afar region.","Cineres nubes 8.5 chiliometrorum altum! Vulcanus primum in milibus annorum erumpit. In Aethiopia, Hayli Gubbi vulcano post mille annos erumpit. Imagines satellitae ostendunt nubem cineris giganteam longe ultra regionem longinquam extendentem.",2025-11-25 19:19:36+00:00
43ebb1f8c6d62f44f9777c04a40c1db6,2025-11-24T19:47:38Z,'Vulkan ausgebrochen',www.n-tv.de,de,0.8,12.000 Jahre Ruhe: Schlafender Vulkan in Äthiopien ausgebrochen,Als eine der ärmsten Regionen Äthiopiens ist Afar immer wieder Naturkatastrophen ausgesetzt. Vulkanausbrüche haben über eine sehr lange Zeit allerdings nicht dazu gezählt. Bis jetzt. Vulkan Hayli Gubbi ist erwacht.,https://www.n-tv.de/panorama/Schlafender-Vulkan-Hayli-Gubbi-in-Aethiopien-ausgebrochen-id30063536.html,https://www.n-tv.de/img/30063539/1764015169/Img_16_9/1200/AFAR-ETHIOPIA-NOVEMBER-23-EDITORIAL-USE-ONLY-MANDATORY-CREDIT-AFAR-GOVERNMENT-COMMUNICATION-BUREAU-HANDOUT-NO-MARKETING-NO-ADVERTISING-CAMPAIGNS-DISTRIBUTED-AS-A-SERVICE-TO-CLIENTS-The-Hayli-Gubbi-volcano-erupted-for-the-first-time-in-12-000-years-spewing-ash-clouds-in-Afar-region-Ethiopia-on-November-23-2025-Afar-Gov.jpg,,"Eine Aschewolke stieg bis auf 8,5 Kilometer Höhe auf. (Foto: picture alliance / Anadolu)
Als eine der ärmsten Regionen Äthiopiens ist Afar immer wieder Naturkatastrophen ausgesetzt. Vulkanausbrüche … [+1954 chars]",,12.000 Jahre Ruhe: Schlafender Vulkan in Äthiopien ausgebrochen. Als eine der ärmsten Regionen Äthiopiens ist Afar immer wieder Naturkatastrophen ausgesetzt. Vulkanausbrüche haben über eine sehr lange Zeit allerdings nicht dazu gezählt. Bis jetzt. Vulkan Hayli Gubbi ist erwacht.,"12,000 years of peace: Sleeping volcano erupts in Ethiopia. As one of the poorest regions in Ethiopia, Afar is repeatedly exposed to natural disasters. However, for a very long time, volcanic eruptions were not included. Until now. Hayli Gubbi volcano has awakened.","12000 annorum pacis: Vulcanus dormiens in Aethiopia erumpit. Ut una ex pauperibus in Aethiopia regionibus, Afar saepe naturalibus calamitatibus exposita est. Tamen diutissime eruptiones vulcanicae non continebantur. Donec nunc. Hayli Gubbi vulcano excitavit.",2025-11-26 19:18:32+00:00
a09e8befe5759597463c0d86c38645fa,2025-11-25T13:41:21Z,'Vulkan Aschewolke',www.tagesschau.de,de,0.8,Asche aus äthiopischem Vulkan behindert Flugverkehr in Indien,Der Ausbruch des Vulkans Hayli Gubbi in Ähthiopien ist glimpflich verlaufen - hat aber Tausende Kilometer entfernt Auswirkungen auf den Flugverkehr: In Indien mussten wegen der Aschewolke mehrere Flüge abgesagt werden.,https://www.tagesschau.de/ausland/afrika/vulkan-aethiopien-ausbruch-102.html,https://images.tagesschau.de/image/80443a5a-a9b5-4b09-80c5-d6b17ce00995/AAABmrs_Vew/AAABmgWmh8Q/16x9-big/vulkan-gubbi-104.jpg?width=1280,http://web.archive.org/web/20251125234526/https://www.tagesschau.de/ausland/afrika/vulkan-aethiopien-ausbruch-102.html,"Stand: 25.11.2025 14:41 Uhr
Der Ausbruch des Vulkans Hayli Gubbi in Ähthiopien ist glimpflich verlaufen - hat aber Tausende Kilometer entfernt Auswirkungen auf den Flugverkehr: In Indien mussten weg… [+1717 chars]",,Asche aus äthiopischem Vulkan behindert Flugverkehr in Indien. Der Ausbruch des Vulkans Hayli Gubbi in Ähthiopien ist glimpflich verlaufen - hat aber Tausende Kilometer entfernt Auswirkungen auf den Flugverkehr: In Indien mussten wegen der Aschewolke mehrere Flüge abgesagt werden.,"Ash from Ethiopian volcano disrupts air traffic in India. The eruption of the Hayli Gubbi volcano in Ethiopia was mild - but has an impact on air traffic thousands of kilometers away: In India, several flights had to be canceled due to the ash cloud.",Cineres ex Volcano Aethiopico commercium aeris rumpit in India. Eruptio Hayli Gubbi vulcani in Aethiopia mitis erat - sed impulsum in aerem mercaturae milia chiliometrorum aufert: In India plures volatus ob nubem cinerem remittantur.,2025-11-26 19:18:32+00:00
1f1dcab59d1a4f723527fd07d3ddb461,2025-11-26T12:30:00Z,'Vulkan ausgebrochen',www.spektrum.de,de,0.8,"Vulkan in Äthiopien: Mehr als 12 000 Jahre, heißt es, sei der Vulkan Hayli Gubbi nicht mehr ausgebrochen - doch möglicherweise stimmt das gar nicht","Erstmals seit 12 000 Jahren sei der Hayli Gubbi ausgebrochen, heißt es. Doch möglicherweise stimmt das nicht. Der Vulkan steht in einer aktiven Region – und ist kaum erforscht.",https://www.spektrum.de/news/vulkanausbruch-des-geheimnisvollen-hayli-gubbi-in-aethiopien/2298276,https://static.spektrum.de/fm/912/f1920x1080/560350091_169.jpg,http://web.archive.org/web/20251127183051/https://www.spektrum.de/news/vulkanausbruch-des-geheimnisvollen-hayli-gubbi-in-aethiopien/2298276,"Eine riesige, fast 15 Kilometer hohe Aschewolke stieg am 23. November 2025 über der Danakil-Senke in Äthiopien auf. In der unwirtlichen, dünn besiedelten Region war zuerst nicht einmal sicher, welche… [+6527 chars]",,"Vulkan in Äthiopien: Mehr als 12 000 Jahre, heißt es, sei der Vulkan Hayli Gubbi nicht mehr ausgebrochen - doch möglicherweise stimmt das gar nicht. Erstmals seit 12 000 Jahren sei der Hayli Gubbi ausgebrochen, heißt es. Doch möglicherweise stimmt das nicht. Der Vulkan steht in einer aktiven Region – und ist kaum erforscht.","Volcano in Ethiopia: It is said that the Hayli Gubbi volcano has not erupted for more than 12,000 years - but that may not be true. It is said that the Hayli Gubbi has erupted for the first time in 12,000 years. But that may not be true. The volcano is in an active region - and has hardly been explored.",Volcano in Aethiopia: Dicitur Hayli Gubbi vulcano non plus quam 12000 annorum erupisse - sed hoc verum esse non potest. Dicitur Hayli Gubbi primum 12000 annorum erupisse. Sed id ipsum nulla. Volcano in regione activa est - et vix explorata est.,2025-11-28 19:17:34+00:00
e432420029e5de97e3c5806708f67da1,2025-11-26T14:50:24Z,'Vulkanausbruch',www.sueddeutsche.de,de,0.9,Vulkanausbruch: Entsteht hier ein neuer Ozean?,Der Ausbruch des kaum erforschten Vulkans Hayli Gubbi in Äthiopien zeigt: Hier ist Größeres im Gange.,https://www.sueddeutsche.de/wissen/aethiopien-vulkanausbruch-hayli-gubbi-li.3344086,https://www.sueddeutsche.de/2025/11/26/74896acf-19bf-490d-94d2-d94c491d94fb.jpg?q=60&fm=webp&width=1200&rect=0%2C77%2C1592%2C895,,"Es ist Montag um etwa halb neun Uhr morgens, als die Bewohner der abgelegenen Region Afar in Äthiopien eine riesige Aschewolke in den Himmel steigen sehen. Bis zu achteinhalb Kilometer hoch steigt si… [+118 chars]",,Vulkanausbruch: Entsteht hier ein neuer Ozean?. Der Ausbruch des kaum erforschten Vulkans Hayli Gubbi in Äthiopien zeigt: Hier ist Größeres im Gange.,Volcanic eruption: Will a new ocean be created here? The eruption of the little-explored Hayli Gubbi volcano in Ethiopia shows that something bigger is afoot here.,Volcanica eruptio: Novus oceanus hic creabitur? Eruptio minimi explorati Hayli Gubbi vulcani in Aethiopia ostendit maius aliquid hic pedibus esse.,2025-11-28 19:17:34+00:00
2af84025603ed256863a84fbe0bc2032,2025-11-26T06:04:55Z,'Vulkan ausgebrochen',www.welt.de,de,0.8,120 Meter hohe Lavafontänen – Vulkan Kilauea ausgebrochen,"Spektakuläre Bilder beim Ausbruch des Vulkans Kilauea auf Hawaii – glühende Lavafontänen stiegen bis zu 120 Meter hoch, 50.000 Tonnen Schwefeldioxid wurden freigesetzt.",https://www.welt.de/vermischtes/video69268d1aed2b4653d17e0e43/hawaii-120-meter-hohe-lavafontaenen-vulkan-kilauea-ausgebrochen.html,https://images.welt.de/69268d1aed2b4653d17e0e43/c4f20cdec5c34e915f8b46e8d6e325ec-master/ci16x9-w1200/apdpa-32b6f4007f198a3f-jpg,,Die WELT als ePaper: Die vollständige Ausgabe steht Ihnen bereits am Vorabend zur Verfügung so sind Sie immer hochaktuell informiert. Weitere Informationen https://epaper.welt.de,,"120 Meter hohe Lavafontänen – Vulkan Kilauea ausgebrochen. Spektakuläre Bilder beim Ausbruch des Vulkans Kilauea auf Hawaii – glühende Lavafontänen stiegen bis zu 120 Meter hoch, 50.000 Tonnen Schwefeldioxid wurden freigesetzt.","120 meter high lava fountains - Kilauea volcano erupted. Spectacular images from the eruption of the Kilauea volcano in Hawaii - glowing lava fountains rose up to 120 meters high and 50,000 tons of sulfur dioxide were released.",120 meter alti fontes lava - Kilauea vulcano erupta. Imagines spectaculares ex eruptione vulcani Kilauea in Hawaii - lavae fervidae usque ad 120 metra alta exorta sunt et 50.000 talenta dioxidis sulphuris emissa sunt.,2025-11-29 13:28:39+00:00
